63,173,64,1,2,1,2008,2,7,0,,5,2,0,3,11.453,0.6177999999999999,"Problemas personales, Deficientes hábitos de estudios",5,0,0,11,2,5,1,,0,0,,0,,1500,500.0,0.0,0.0,2000.0,300.0,300.0,0.0,0.0,300.0,0.0,1000.0,0.0,100.0,2000.0,6,2,9000.0,7000.0,16000.0,6000.0,5000.0,0.0,2000.0,0.0,0.0,2000.0,0.0,1000.0,16000.0,5,Agradezco toda la ayuda prestada por parte del servicio de trabajo social y ser comprensivos con respecto a las situaciones de cada estudiante,2015,1,23,8,1989,1500
64,190,65,1,2,1,2008,4,10,0,,1,1,0,0,14.459999999999999,0.9720000000000001,,1,1,1,2,2,10,3,"el cementerio Av. Soosevelt, sector los jabillos, , quinta floriver",0,0,,0,,1500,4000.0,1000.0,0.0,6500.0,2000.0,1000.0,0.0,0.0,0.0,2700.0,2000.0,0.0,0.0,7700.0,4,2,11000.0,,11000.0,2700.0,5000.0,3000.0,0.0,2000.0,4000.0,100.0,0.0,0.0,16800.0,3,mejorar la comunicaciòn de las fechas de renovaciòn.,2015,1,4,5,1992,1500
65,78,66,1,2,1,2010,2,5,0,,5,3,1,1,12.985999999999999,0.7526,"Falta de tiempo para estudiar, Mala distribución del tiempo, Lejanía entre la residencia y la universidad",4,0,0,2,2,5,1,"Av. Guzmán Blanco, cota 905. Res. La Veguita. Edif Los Monjes. Piso 9 ",0,0,,0,,1500,600.0,0.0,0.0,2100.0,400.0,550.0,0.0,0.0,200.0,0.0,900.0,0.0,0.0,2050.0,5,4,14000.0,8000.0,22000.0,0.0,9000.0,5000.0,2000.0,0.0,0.0,1600.0,800.0,1500.0,19900.0,4,En general la atención prestada es buena. ,2015,1,18,12,1990,1500
66,127,67,1,2,1,2008,4,8,0,,3,3,0,0,12.75,0.85,,2,0,0,12,2,10,0,LOS ROSALES. AV EL PASEO. QUINTA VILLA COROMOTO,0,0,,0,,1500,3000.0,0.0,0.0,4500.0,1700.0,100.0,0.0,0.0,300.0,1900.0,500.0,0.0,0.0,4500.0,3,3,9000.0,,9000.0,0.0,5000.0,500.0,0.0,0.0,0.0,0.0,0.0,0.0,9000.0,5,ESTOY SATISFECHA CON SU ATENCION,2015,1,21,9,1991,1500
67,197,68,1,1,1,2009,4,8,0,,5,5,0,0,12.975,0.8962999999999999,,4,0,0,13,2,2,1,,0,0,,0,,1500,4500.0,0.0,0.0,6000.0,1500.0,500.0,800.0,300.0,600.0,0.0,1000.0,800.0,500.0,6000.0,3,3,9800.0,6000.0,15800.0,0.0,4000.0,1000.0,3000.0,2000.0,1000.0,800.0,1500.0,2500.0,15800.0,5,Buena atención y proceso mas rápido al estar en la escuela de bioanalisis para la recepción de documentos.,2014,2,26,10,1991,1500
68,143,69,1,2,1,2008,4,9,0,,4,4,0,0,13.489,0.9456,,2,1,1,2,2,3,1,,0,0,,0,,1500,3000.0,0.0,0.0,4500.0,2000.0,300.0,200.0,0.0,500.0,0.0,1000.0,300.0,200.0,4500.0,3,3,5622.0,4000.0,9622.0,0.0,5000.0,100.0,900.0,0.0,0.0,600.0,1000.0,0.0,7700.0,4,Me parece prestan buena atención al público ,2014,2,23,8,1991,1500
69,24,70,1,2,2,2011,2,5,0,,3,2,0,1,12.218,0.9142999999999999,"Problemas con el/la docente, Lejanía entre la residencia y la universidad",2,0,0,6,4,3,6,,0,0,,0,,1500,1400.0,2000.0,0.0,4900.0,0.0,2420.0,2000.0,1500.0,2500.0,0.0,2000.0,0.0,1000.0,11420.0,3,3,10900.0,4000.0,14900.0,6000.0,5000.0,7664.0,4000.0,2000.0,2350.0,380.0,300.0,700.0,28394.0,4,Concidero que es apta ya que por ser la única escuela que se encuentra lejos de la ciudad universitaria nos facilitan aceptar los datos requeridos en dicha escuela,2014,2,30,5,1993,1500
70,65,71,1,2,1,2009,2,10,0,,1,1,0,0,14.814000000000002,1.0,,1,1,1,0,0,5,1,,0,0,,0,,1500,2500.0,0.0,0.0,4000.0,1200.0,300.0,0.0,0.0,1000.0,0.0,1500.0,0.0,0.0,4000.0,5,3,6761.0,,6761.0,0.0,3000.0,900.0,0.0,0.0,0.0,0.0,0.0,0.0,3900.0,5,Felicidades por hacer esta parte del proceso vía internet,2015,1,1,11,1991,1500
71,102,72,1,2,1,2009,4,9,0,,4,4,0,0,14.314,0.9722,,2,1,1,14,2,2,1,Edificio Doralta. Avenida Las Acacias.Caracas.,0,0,,0,,1500,2000.0,1000.0,0.0,4500.0,1500.0,200.0,1000.0,0.0,1000.0,0.0,800.0,0.0,0.0,4500.0,5,4,10323.0,0.0,10323.0,0.0,6123.0,200.0,1000.0,1000.0,1000.0,500.0,0.0,500.0,10323.0,5,"Excelente trabajo, agradecida por la ayuda aportada todo este tiempo.",2015,1,28,6,1993,1500
72,172,73,1,1,1,2011,2,8,0,,4,4,0,0,13.0,1.0,,4,0,0,1,1,3,1,,0,0,,0,,1500,1500.0,0.0,0.0,3000.0,1000.0,1000.0,1000.0,0.0,1000.0,0.0,1000.0,500.0,500.0,6000.0,3,2,30000.0,,30000.0,0.0,15000.0,5000.0,2000.0,0.0,1500.0,3000.0,1000.0,2000.0,29500.0,5,EVALUAR LA POSIBILIDAD DE SUBIR EL MONTO DE LA BECA YA QUE 1500BSF NO SE AJUSTA A LA REALIDAD DE GASTOS QUE POSEE UN ESTUDIANTE,2015,1,19,10,1991,1500
73,55,74,1,2,2,2011,2,8,0,,2,2,10,3,14.13,1.0,,3,0,0,0,0,16,3,"av principal francisco de miranda, boleita sur, edificio sarina piso 4 apartamento 4-1.",0,0,,0,,1500,3500.0,1500.0,0.0,6500.0,1500.0,300.0,0.0,0.0,500.0,4000.0,200.0,0.0,0.0,6500.0,5,2,7000.0,2000.0,9000.0,0.0,2000.0,500.0,2000.0,0.0,0.0,1000.0,800.0,1000.0,7300.0,4,"la gestión es mucho mas rápida por este medio, no tengo inconvenientes de ningún tipo con el servicio de becas estudiantil.",2015,1,12,7,1993,1500
74,104,75,1,2,1,2011,4,7,0,,5,5,0,0,15.557,1.0,,5,0,0,7,3,2,3,"Urbanización Cumbres de Curumo, Avenida Principal, Edificio Araucaria",0,0,,0,,1500,6000.0,0.0,0.0,7500.0,2000.0,300.0,200.0,0.0,400.0,3000.0,500.0,0.0,200.0,6700.0,5,5,10000.0,5000.0,15000.0,0.0,7000.0,400.0,1000.0,0.0,200.0,1500.0,500.0,2000.0,12600.0,5,"No presento quejas al respecto, de verdad que la beca es una gran ayuda para los estudiantes y más ahora en la situación en la que vivimos",2015,2,13,4,1993,1500
75,116,76,1,2,1,2013,2,3,0,,5,5,0,0,15.388,1.0,,6,0,0,2,2,5,1,,0,0,,0,,1500,2500.0,0.0,0.0,4000.0,4000.0,400.0,700.0,600.0,700.0,0.0,700.0,500.0,260.0,7860.0,5,4,37318.75,,37318.75,0.0,20000.0,1300.0,3000.0,600.0,5400.0,700.0,1900.0,10000.0,42900.0,5,"que todo el proceso se pueda llevar en base electronica, mediante el scan de documentos",2014,2,20,7,1991,1500
76,103,77,1,2,1,2012,2,4,0,,6,5,1,0,14.960999999999999,1.0,,5,0,0,2,2,5,1,,0,0,,0,,1500,1500.0,0.0,0.0,3000.0,700.0,500.0,500.0,0.0,500.0,0.0,1000.0,500.0,0.0,3700.0,3,4,9777.0,5000.0,14777.0,0.0,5000.0,1500.0,2000.0,0.0,1500.0,3000.0,1000.0,1000.0,15000.0,4,MUY BUEN SERVICIO,2015,1,8,7,1994,1500
77,48,78,1,2,2,2014,3,3,0,,5,5,0,0,16.833,1.0,,5,0,0,9,7,3,3,"calle miranda, chacao",0,0,,0,,1500,1500.0,0.0,0.0,3000.0,400.0,300.0,0.0,0.0,500.0,0.0,650.0,700.0,450.0,3000.0,3,1,7500.0,,7500.0,4120.0,1000.0,100.0,900.0,0.0,0.0,400.0,0.0,300.0,6820.0,4,"en lugar de tener un solo trabajador social para gestionar la beca, asignar un segundo para cubrir la gran demanda ",2014,2,3,4,1993,1500
78,76,79,1,2,1,2010,2,7,0,,4,4,0,0,14.114,1.0,,4,0,0,2,2,17,1,"Altagracia norte 4, esq. De salas.",0,0,,0,,1500,1000.0,0.0,0.0,2500.0,0.0,0.0,0.0,0.0,0.0,0.0,4000.0,0.0,500.0,4500.0,3,2,12000.0,,12000.0,2000.0,4000.0,2000.0,0.0,0.0,0.0,700.0,500.0,0.0,10000.0,5,No cambiar tanto a la trabajadora social.,2015,1,10,1,1992,1500
79,31,80,1,2,2,2014,2,3,0,,5,5,0,0,11.833,1.0,,5,0,0,2,2,5,1,,0,0,,0,,1500,1000.0,0.0,0.0,2500.0,500.0,400.0,0.0,0.0,250.0,0.0,800.0,0.0,600.0,2550.0,5,3,7028.0,5622.0,12650.0,0.0,6000.0,1000.0,0.0,0.0,2000.0,600.0,2000.0,1000.0,12600.0,5,Excelente forma de renovar.,2015,1,8,10,1992,1500
80,169,81,1,2,1,2010,2,7,0,,4,4,0,0,13.196,0.9824999999999999,,6,0,0,2,2,5,1,23 de Enero,0,0,,0,,1500,2000.0,1000.0,0.0,4500.0,1000.0,1000.0,300.0,0.0,700.0,0.0,1000.0,0.0,500.0,4500.0,6,2,10000.0,10000.0,20000.0,0.0,13000.0,3000.0,1000.0,0.0,0.0,1000.0,200.0,1500.0,19700.0,5,...,2014,2,13,9,1991,1500
81,99,82,1,2,1,2011,2,7,0,,4,4,0,0,14.59,1.0,,5,0,0,2,2,3,1,,0,1,Beca ayudantía en el año 2011 Universidad Central de Venezuela (OBE) apoyo económico para material de estudio,0,,1500,0.0,0.0,1000.0,2500.0,500.0,0.0,0.0,0.0,500.0,0.0,1500.0,0.0,0.0,2500.0,3,2,6050.0,,6050.0,1500.0,3200.0,500.0,0.0,0.0,0.0,800.0,0.0,0.0,6000.0,4,Un horario un poco más amplio de atención ya que el horario de clases siempre choca,2014,2,13,8,1992,1500
82,113,83,1,2,1,2009,2,8,0,,5,3,0,2,12.0,0.7982000000000001,"Problemas personales, Problemas económicos",5,0,0,3,4,19,1,"Urb. La Rosaleda Sur, Edf. Atabapo",0,0,,0,,1000,1500.0,3000.0,1000.0,6500.0,1500.0,300.0,300.0,0.0,1000.0,1000.0,3000.0,1000.0,2000.0,10100.0,3,2,11550.0,7000.0,18550.0,0.0,9000.0,1000.0,1000.0,0.0,3000.0,3000.0,600.0,2000.0,19600.0,5,"Consideracion para los estudiantes , ya que somos una de las victimas mas afectadas de esta horrible inflación , los materiales de estudio se han vuelto cada vez mas costosos y pues estudiar es ya casi una mision dificil por no decir imposible",2015,1,24,1,1992,1500
83,191,84,1,2,1,2011,4,6,0,,5,5,0,0,13.67,0.9670000000000001,,4,0,0,15,2,4,9,,0,1,"solicitud en 2013. 
ayuda economica 
",0,,1500,2000.0,0.0,0.0,3500.0,1500.0,500.0,0.0,0.0,0.0,0.0,1000.0,0.0,500.0,3500.0,5,2,5000.0,,5000.0,0.0,3000.0,500.0,500.0,0.0,0.0,300.0,0.0,700.0,5000.0,5,para la renovacion de becas extender el horario de atencion .,2014,2,29,10,1993,1500
84,98,85,1,1,1,2011,4,7,0,,4,4,0,0,14.675999999999998,1.0,,4,0,0,11,2,20,0,,0,1,"Año solicitud 2013
Institución: Universidad Central de Venezuela (OBE)
Motivo: Transporte, Materiales Estudios, Comida",0,,1500,1500.0,0.0,0.0,3000.0,900.0,1600.0,0.0,0.0,0.0,0.0,500.0,0.0,0.0,3000.0,3,3,5622.0,,5622.0,0.0,2500.0,1000.0,2000.0,0.0,0.0,122.0,0.0,0.0,5622.0,4,"Colocar un amplio horario de atención, debido a que chocan con los horario académicos",2014,2,21,6,1993,1500
85,138,86,1,1,1,2011,4,7,0,,4,4,0,0,15.877,1.0,,6,0,0,2,2,5,9,,0,0,,0,,1500,800.0,0.0,0.0,2300.0,500.0,150.0,0.0,0.0,600.0,0.0,1000.0,0.0,50.0,2300.0,3,3,8000.0,,8000.0,1500.0,4000.0,500.0,2000.0,0.0,0.0,0.0,0.0,0.0,8000.0,4,"la atención brindada esta acorde con el tramite realizado, lo puedo catalogar como buena.",2014,2,20,2,1992,1500
86,20,87,1,2,2,2010,2,7,0,,2,2,0,0,12.9,0.9,,2,0,1,2,2,3,1,,0,0,,0,,1500,1000.0,0.0,0.0,2500.0,500.0,800.0,0.0,0.0,0.0,0.0,500.0,200.0,500.0,2500.0,3,5,5600.0,5000.0,10600.0,0.0,5000.0,1200.0,600.0,0.0,1000.0,1000.0,800.0,1000.0,10600.0,5,Ninguna esto nos ayuda a agilizar el proceso ,2015,2,7,6,1993,1500
87,11,88,1,2,2,2009,2,5,1,"vivia con mi tia, ahora vivo con mi madre en los valles del tuy",2,2,0,0,11.604000000000001,0.76,,2,0,0,5,5,3,9,,0,1,fames ayuda para maternidad,0,,1500,1000.0,0.0,0.0,2500.0,500.0,1000.0,0.0,0.0,500.0,0.0,500.0,0.0,0.0,2500.0,3,4,4480.0,2000.0,6480.0,0.0,2000.0,1000.0,0.0,0.0,0.0,1000.0,600.0,1000.0,5600.0,5,la atencion siempre a sido excelente y  tiempo. y lo mejor es que ahora la renovación la podemos hacer en la escuela,2014,2,3,4,1992,1500
88,81,89,1,2,1,2012,2,5,0,,4,4,0,0,17.22,1.0,,7,0,0,9,7,3,9,,0,0,,0,,1500,400.0,0.0,0.0,1900.0,1500.0,400.0,300.0,0.0,1000.0,0.0,1000.0,500.0,500.0,5200.0,3,2,7980.0,,7980.0,0.0,7000.0,1000.0,1500.0,0.0,0.0,400.0,0.0,800.0,10700.0,5,muy buen servicio,2014,2,18,4,1993,1500
89,181,90,1,2,1,2010,2,7,0,,5,4,1,0,13.335999999999999,0.9303999999999999,,4,0,0,16,2,2,1,,0,0,,0,,1500,500.0,500.0,0.0,2500.0,1000.0,600.0,200.0,0.0,1000.0,0.0,2000.0,500.0,300.0,5600.0,4,4,9100.0,,9100.0,0.0,4000.0,1000.0,0.0,0.0,1000.0,500.0,0.0,0.0,6500.0,4,mayor flexibilidad en el horario de renovacion de beca.,2015,1,24,5,1991,1500
90,25,91,1,2,2,2010,2,6,0,,3,3,0,0,11.158,0.6949,,1,1,0,1,2,3,1,,0,0,,0,,1500,1000.0,0.0,0.0,2500.0,0.0,1500.0,0.0,0.0,0.0,0.0,1000.0,0.0,0.0,2500.0,3,4,5500.0,,7000.0,0.0,5000.0,500.0,0.0,0.0,0.0,0.0,0.0,0.0,5500.0,4,cumplir con el pago a tiempo.,2014,2,21,11,1992,1500
91,175,92,1,2,1,2010,2,4,0,,3,1,1,1,12.7,0.7272999999999998,"Problemas familiares, Deficiente formación del bachillerato",4,0,0,1,1,5,6,,0,0,,0,,1500,1500.0,0.0,0.0,3000.0,1200.0,700.0,300.0,0.0,300.0,0.0,300.0,0.0,200.0,3000.0,3,5,10810.91,7500.0,18310.91,400.0,5000.0,1400.0,2450.0,1000.0,3500.0,750.0,800.0,3000.0,18300.0,5,"seguir manteniendo el buen trato con los alumnos, y mantenernos informados de lo que ocurre en la univerisidad con respecto a la beca",2015,1,22,5,1993,1500
92,5,93,1,2,2,2011,4,7,0,,2,2,0,0,13.078,0.9828999999999999,,2,1,3,1,1,5,9,,0,0,,0,,1500,900.0,0.0,0.0,2400.0,700.0,500.0,0.0,0.0,100.0,0.0,1000.0,0.0,100.0,2400.0,5,4,8000.0,,8000.0,800.0,4000.0,1500.0,0.0,0.0,650.0,250.0,400.0,300.0,7900.0,4,"Tomar en cuenta que continuamos cursando estudios en la universidad y debido a la situación del país se ha hecho difícil conseguir un empleo en la rama de enfermería, que facilite el horario y colabora al crecimiento profesional educativo.",2014,2,27,8,1993,1500
93,69,94,1,2,1,2011,4,6,0,,6,5,1,0,13.227,0.8587,,3,0,0,17,3,4,1,,0,0,,0,,1500,1500.0,0.0,0.0,3000.0,500.0,100.0,300.0,0.0,600.0,0.0,1300.0,200.0,0.0,3000.0,5,3,6700.0,0.0,6700.0,0.0,5000.0,1000.0,1500.0,0.0,2000.0,1000.0,0.0,700.0,11200.0,3,"Luchar por un aumento de beca ya que la situación económica es realmente fuerte, aun más para aquellos que presentan bajos recursos monetarios al mes",2014,2,17,8,1993,1500
94,101,95,1,2,1,2009,2,8,0,,4,4,0,0,13.222,0.9512,,3,0,0,0,0,3,1,,0,0,,0,,1500,3000.0,1000.0,0.0,5500.0,2000.0,1500.0,1000.0,0.0,2500.0,0.0,2000.0,2500.0,355.0,11855.0,5,2,10000.0,8000.0,18000.0,0.0,12000.0,3000.0,0.0,0.0,2500.0,3500.0,2100.0,5000.0,28100.0,5,Siempre son amables y responsables. Ojalá pudieran tener mas apoyo para poder hacer mas!,2014,2,9,11,1992,1500
95,150,96,1,2,1,2008,3,10,0,,0,0,0,0,12.947,0.9267,,1,1,1,2,2,3,9,,0,0,,0,,1500,600.0,600.0,0.0,2700.0,1000.0,500.0,1000.0,1000.0,500.0,0.0,1500.0,1000.0,1000.0,7500.0,3,4,5622.48,3000.0,8622.48,0.0,3000.0,1500.0,1000.0,1000.0,500.0,500.0,0.0,500.0,8000.0,4,ES IMPORTANTE QUE EL HORARIO DE ATENCIO SEA MAS FLEXIBLE,2015,1,22,2,1991,1500
96,95,97,1,2,1,2011,4,6,0,,5,5,0,0,13.824000000000002,0.9681000000000001,,4,0,0,5,5,3,9,,0,0,,0,,1500,1500.0,0.0,0.0,3000.0,500.0,1000.0,0.0,0.0,300.0,0.0,1200.0,0.0,0.0,3000.0,10,3,6750.0,0.0,6750.0,0.0,3500.0,1500.0,0.0,0.0,1500.0,250.0,0.0,0.0,6750.0,5,es excelente la atención recibida,2014,2,19,2,1994,1500
97,46,98,1,2,2,2011,2,6,0,,3,3,0,0,12.171,0.9812999999999998,,1,0,0,2,2,5,9,,0,0,,0,,1500,1000.0,500.0,0.0,3000.0,600.0,400.0,300.0,800.0,300.0,0.0,500.0,200.0,200.0,3300.0,5,4,7500.0,5000.0,12500.0,0.0,6000.0,1000.0,2000.0,2000.0,100.0,400.0,500.0,500.0,12500.0,5,excelente trato,2014,2,9,11,1993,1500
98,131,99,1,2,1,2008,4,8,0,,4,2,1,1,12.024000000000001,0.8378,Elevada carga horaria,4,0,0,18,0,22,3,"urb horizonte, av petare, qta merpe, el marques",0,0,,0,,1500,4000.0,500.0,0.0,6000.0,2000.0,500.0,0.0,0.0,0.0,2500.0,700.0,0.0,300.0,6000.0,3,4,15000.0,,15000.0,0.0,5000.0,500.0,2000.0,0.0,8000.0,1000.0,0.0,1000.0,17500.0,5,"muy buen trabajo, graciaas",2014,2,1,11,1990,1500
99,8,100,1,2,2,2010,2,7,0,,2,2,0,0,13.782,0.9828999999999999,Problemas económicos,2,0,0,4,3,3,1,,0,0,,0,,1500,1000.0,0.0,0.0,2500.0,1400.0,760.0,0.0,0.0,0.0,0.0,150.0,60.0,130.0,2500.0,3,2,6560.0,,6560.0,0.0,3000.0,460.0,800.0,0.0,0.0,800.0,0.0,1500.0,6560.0,5,Me parece han realizado un excelente trabajo ya que proporcionan la información precisa y con antelación. ,2014,2,27,2,1992,1500
100,118,101,1,2,1,2008,4,6,0,,6,5,1,1,12.706,0.7898999999999999,"Falta de tiempo para estudiar, Mala distribución del tiempo, Lejanía entre la residencia y la universidad",4,0,0,19,2,3,9,,0,0,,0,,1500,2000.0,700.0,0.0,4200.0,500.0,3500.0,0.0,0.0,0.0,0.0,1000.0,0.0,0.0,5000.0,3,3,12749.0,3000.0,15749.0,0.0,6500.0,6700.0,2000.0,0.0,0.0,100.0,0.0,349.0,15749.0,4,Promover e informar mejor los servicios que OBE presta. ,2014,2,21,11,1991,1500
101,151,102,1,2,1,2011,3,7,0,,4,4,0,0,13.806000000000001,0.9622999999999999,,5,0,0,0,0,5,0,,0,0,,0,,1950,600.0,0.0,500.0,3050.0,1000.0,100.0,0.0,0.0,1500.0,0.0,2000.0,1000.0,300.0,5900.0,5,5,180000.0,,180000.0,0.0,10000.0,300.0,0.0,0.0,1300.0,4000.0,350.0,4000.0,19950.0,5,"Muy buena, la renovacion online ahorra mucho tiempo y hace el proceso de renovacion mas rapido y eficaz",2014,2,22,11,1993,1500
102,21,103,1,2,2,2011,2,7,0,,2,2,0,2,13.339000000000002,0.13125,,2,0,3,2,2,3,9,Final Pasaje 11 Callle Carbonell Casa N 10 El Amparo Catia ,0,0,,0,,1500,1000.0,500.0,0.0,3000.0,1000.0,200.0,0.0,1000.0,300.0,0.0,500.0,0.0,0.0,3000.0,3,4,5000.0,,5000.0,0.0,2000.0,500.0,300.0,1000.0,1000.0,200.0,0.0,0.0,5000.0,5,"Como recomendación ofrecer becas a los estudiantes de licenciaturas muchos no tienen la posibilidad ni el tiempo de trabajar por horarios de estudios y trabajos en clínicas, mucha veces se ve forzado para otros no, lo ideal, es que se estudie cada caso según lo amerite el estudiante, en mi caso lo veo forzado salir de clases a las 12 m para ir corriendo a la clínica y salir a las 7 pm en que tiempo se descansa y se estudia o otros casos q trabajan de noche salir amanecidos para recibir clases por tal motivo no trabajo ",2014,2,10,4,1993,1500
103,22,104,1,2,2,2011,2,7,0,,2,2,0,2,13.339000000000002,0.13339000000000004,,2,0,3,2,2,3,9,Final Pasaje 11 Callle Carbonell Casa N 10 El Amparo Catia ,0,0,,0,,1500,1000.0,500.0,0.0,3000.0,1000.0,200.0,0.0,1000.0,300.0,0.0,500.0,0.0,0.0,3000.0,3,4,5000.0,,5000.0,0.0,2000.0,500.0,300.0,1000.0,1000.0,200.0,0.0,0.0,5000.0,5,"Como recomendación ofrecer becas a los estudiantes de licenciaturas muchos no tienen la posibilidad ni el tiempo de trabajar por horarios de estudios y trabajos en clínicas, mucha veces se ve forzado para otros no, lo ideal, es que se estudie cada caso según lo amerite el estudiante, en mi caso lo veo forzado salir de clases a las 12 m para ir corriendo a la clínica y salir a las 7 pm en que tiempo se descansa y se estudia o otros casos q trabajan de noche salir amanecidos para recibir clases por tal motivo no trabajo ",2014,2,10,4,1993,1500
104,153,105,1,2,1,2009,2,9,0,,4,4,0,0,14.157,0.9722,,2,1,1,2,2,5,1,,0,0,,0,,1500,1500.0,1000.0,2000.0,6000.0,1200.0,200.0,500.0,400.0,1200.0,0.0,800.0,1800.0,500.0,6600.0,5,3,10500.0,6000.0,16500.0,0.0,5000.0,800.0,2500.0,600.0,4000.0,500.0,1200.0,1200.0,15800.0,5,Yo particularmente nunca he tenido problemas con este sistema...siempre están atentos a cualquier inconveniente y siempre lo solventan lo mas rápido posible.,2014,2,27,3,1992,1500
105,164,106,1,2,1,2010,4,7,0,,5,4,0,1,13.969,0.9245000000000001,Problemas personales,4,0,0,20,1,2,9,,0,0,,0,,1500,3000.0,0.0,0.0,4500.0,1500.0,1000.0,0.0,0.0,500.0,0.0,600.0,500.0,400.0,4500.0,3,3,16000.0,4000.0,20000.0,0.0,7000.0,2000.0,3000.0,0.0,0.0,2000.0,1000.0,5000.0,20000.0,5,"Expandir la hora para renovar las becas hasta las 3/4pm porque habemos muchos que no podemos ir en el horario entre las 8.30am y la 1.30pm debido a los laboratorios prácticos de la carrera, de los cuales no podemos salir, para dirigirnos a hacer la renovación. Si se expande la hora podemos ir a las 2pm cosa de no perder clases y cumplir con este requisito de renovación. ",2015,1,6,4,1992,1500
106,132,107,1,2,1,2012,2,2,0,,4,1,1,2,12.128,0.6609999999999999,"Problemas familiares, Problemas económicos, Problemas de salud, Problemas vocacionales, Falta de tiempo para asistir a clases, Falta de tiempo para estudiar, Deficientes hábitos de estudios",3,0,0,2,2,3,1,,0,0,,0,,1500,0.0,0.0,0.0,1500.0,400.0,300.0,0.0,0.0,0.0,0.0,800.0,0.0,0.0,1500.0,3,2,10630.0,,10630.0,0.0,7000.0,600.0,0.0,0.0,0.0,1000.0,1000.0,800.0,10400.0,5,"Hasta ahora, todo excelente... Gente comprometida a prestar un servicio de calidad, se les agradece. ",2015,1,31,5,1994,1500
107,38,108,1,2,2,2012,2,6,0,,3,3,0,0,12.380999999999998,1.0,,2,1,1,5,2,4,9,,0,0,,0,,1500,1000.0,300.0,0.0,2800.0,200.0,300.0,0.0,0.0,400.0,0.0,200.0,0.0,200.0,1300.0,5,3,10500.0,,10500.0,0.0,3000.0,2000.0,2500.0,0.0,0.0,1000.0,500.0,1500.0,10500.0,5,Seguir con el buen servicio prestado.,2015,1,26,3,1994,1500
108,196,109,1,1,1,2010,2,7,0,,4,4,0,0,13.981,0.9640000000000001,,4,0,0,1,2,3,1,,0,0,,0,,1500,1000.0,1000.0,0.0,3500.0,1000.0,1000.0,0.0,0.0,0.0,0.0,1000.0,500.0,120.0,3620.0,3,2,9668.2,,9668.2,500.0,1500.0,1000.0,0.0,0.0,2000.0,0.0,900.0,800.0,6700.0,5,Seguir atendiendo con calidad humana ,2015,1,13,11,1991,1500
109,112,110,1,1,1,2011,2,7,0,,5,5,0,0,15.687999999999999,1.0,,4,0,0,1,1,3,6,,0,0,,0,,1500,5000.0,0.0,0.0,6500.0,2000.0,2500.0,0.0,0.0,500.0,0.0,1000.0,500.0,0.0,6500.0,3,2,10000.0,12000.0,22000.0,0.0,13000.0,4000.0,0.0,0.0,4000.0,1000.0,0.0,0.0,22000.0,5,Ninguna,2015,1,9,7,1993,1500
110,155,111,1,2,1,2011,2,6,0,,4,4,0,0,16.907999999999998,1.0,,5,0,0,1,2,4,1,Caracas. Municipio Libertador. Jardines del Valle,0,0,,0,,1500,3500.0,0.0,0.0,5000.0,2000.0,500.0,0.0,0.0,500.0,0.0,1500.0,500.0,0.0,5000.0,3,2,12000.0,,12000.0,0.0,6000.0,1000.0,1500.0,0.0,1500.0,1500.0,500.0,0.0,12000.0,5,Muchas gracias por su labor. Continúen así.,2015,1,1,1,1994,1500
111,159,112,1,2,1,2010,4,7,0,,4,4,0,0,13.6,1.0,,4,0,0,1,1,3,9,"Guarenas, Edo. Miranda Urb. Oropeza Castillo, zona 1, vereda 14, casa1",0,1,"2015, ucv, falta de ingresos, ayuda economica",0,,1500,4000.0,1000.0,500.0,7000.0,2000.0,1000.0,500.0,500.0,1000.0,0.0,1000.0,1000.0,0.0,7000.0,5,3,15000.0,2000.0,17000.0,0.0,4000.0,2000.0,1000.0,0.0,2000.0,400.0,0.0,1000.0,10400.0,5,ha sido una excelente atención!! ,2014,1,1,2,1993,1500
112,74,113,1,1,1,2012,2,5,0,,4,4,0,0,13.520999999999997,0.9452000000000002,,7,0,0,6,4,3,0,,0,0,,0,,1500,1800.0,0.0,2000.0,5300.0,1600.0,1400.0,200.0,0.0,250.0,0.0,1300.0,0.0,300.0,5050.0,3,2,6000.0,3000.0,9000.0,0.0,4000.0,200.0,3000.0,0.0,0.0,600.0,0.0,300.0,8100.0,5,"excelente servicio, se recomienda que sea mas automatico ",2014,2,5,12,1992,1500
113,187,114,1,1,1,2008,4,10,0,,2,2,0,0,14.385,1.0,,2,1,1,6,4,4,1,,0,0,,0,,1500,1000.0,0.0,0.0,2500.0,200.0,200.0,100.0,500.0,0.0,0.0,1000.0,0.0,500.0,2500.0,3,2,7209.52,,7209.52,0.0,5000.0,100.0,109.52,0.0,1000.0,0.0,0.0,1000.0,7209.52,4,"mejorar la comunicacion con los becarios, ya que me entere el ultimo dia que habia renovacion de la beca",2014,2,27,12,1990,1500
114,84,115,1,2,1,2010,4,5,0,,4,4,0,0,15.666,1.0,,7,0,0,2,2,3,1,,0,0,,0,,1500,500.0,500.0,0.0,2500.0,500.0,0.0,0.0,0.0,500.0,0.0,1000.0,500.0,0.0,2500.0,4,4,5622.48,2000.0,7622.48,0.0,4000.0,500.0,1000.0,0.0,0.0,600.0,500.0,1000.0,7600.0,4,Que sigan así!,2015,1,17,6,1993,1500
115,193,116,1,2,1,2008,4,10,0,,2,2,0,2,13.919999999999998,1.0,,2,1,1,5,2,8,5,Plaza Venezuela,0,0,,0,,1500,500.0,500.0,0.0,2500.0,1000.0,50.0,0.0,0.0,400.0,150.0,200.0,0.0,50.0,1850.0,5,3,8000.0,2000.0,10000.0,0.0,9000.0,500.0,0.0,0.0,0.0,500.0,200.0,500.0,10700.0,3,"FLEXIBILIZAR LOS HORARIOS DE ATENCION PARA LOS QUE ESTAMOS DE PASANTIAS

MANTENERNOS INFORMADOS",2014,2,13,12,2015,1500
116,87,117,1,2,1,2009,4,5,0,,4,4,0,0,13.5,1.0,,5,0,0,11,2,19,5,caracas san agustin del norte esquina arismendi,0,0,,0,,1500,1500.0,0.0,0.0,3000.0,700.0,200.0,100.0,0.0,200.0,1500.0,300.0,0.0,0.0,3000.0,5,3,5660.0,,5660.0,0.0,3860.0,300.0,0.0,0.0,0.0,0.0,0.0,0.0,5660.0,4,ninguna,2015,1,30,6,1993,1500
117,110,118,1,2,1,2010,4,8,0,,5,5,0,0,13.620999999999999,1.0,,4,0,0,8,6,2,1,,0,0,,0,,1500,500.0,500.0,0.0,2500.0,1500.0,300.0,1000.0,0.0,600.0,0.0,3000.0,600.0,600.0,7600.0,11,3,3000.0,2000.0,5000.0,0.0,3000.0,0.0,3000.0,0.0,0.0,1000.0,3000.0,1000.0,11000.0,4,"deben ser preguntas mas claras y no pedir tantos monto, ya que con la situación del país se hace difícil discernir cuanto se gasta.  ",2014,2,24,6,1991,1500
118,62,119,1,2,2,2012,2,2,0,,2,2,0,2,10.333,0.5333,,4,0,0,2,2,3,1,"AV. LEONARDO RUIZ PINEDA RES. HORNOS DE CAL TORRE C PISO 5 ,APTO. 58C, SAN AGUSTIN DEL SUR.",0,0,,0,,1500,3000.0,0.0,0.0,4500.0,1500.0,680.0,2000.0,2000.0,1500.0,0.0,2000.0,0.0,750.0,10430.0,3,4,6000.0,2000.0,8000.0,300.0,4000.0,880.0,3500.0,4000.0,2500.0,700.0,300.0,1000.0,17180.0,5,No tengo ninguna sugerencia y recomendación ,2015,1,12,7,1994,1500
119,122,120,1,2,1,2011,2,5,0,,3,3,0,0,14.422999999999998,1.0,,6,0,0,2,2,3,3,Av. Almamater. Edificio Romeo. Piso 6. Apartamento 136,0,1,"Año: 2013. Institucion: OBE. Motivo: ayuda económica para rehabilitación (fisioterapia), ya que me atropello una moto.",0,,1500,1500.0,0.0,0.0,3000.0,1200.0,180.0,0.0,0.0,1000.0,0.0,400.0,0.0,200.0,2980.0,5,2,7265.0,5000.0,12265.0,3500.0,5000.0,300.0,1500.0,0.0,0.0,300.0,0.0,200.0,10800.0,5,"Sigan prestando su servicio como lo han hecho hasta ahora, ya que su trabajo ayuda a muchos estudiantes que lo necesitamos.",2014,2,18,8,1994,1500
120,14,121,1,2,2,2011,2,6,0,,3,3,0,0,11.8,0.9722,,2,1,3,3,2,4,1,,0,0,,0,,1500,3000.0,1000.0,0.0,5500.0,3000.0,1200.0,0.0,0.0,2500.0,0.0,2800.0,1500.0,2000.0,13000.0,5,3,8656.0,3500.0,12156.0,0.0,5000.0,3000.0,0.0,0.0,800.0,300.0,150.0,2500.0,11750.0,3,dar mas días para entregar los recaudos de renovacion.,2014,2,26,6,1994,1500
121,35,122,1,2,2,2010,2,7,0,,2,2,0,0,13.565000000000001,0.9828999999999999,Mala distribución del tiempo,2,0,0,2,2,3,1,,0,0,,0,,1500,1000.0,0.0,0.0,2500.0,550.0,200.0,0.0,0.0,0.0,0.0,1300.0,0.0,250.0,2300.0,3,2,8500.0,,8500.0,0.0,2500.0,500.0,300.0,0.0,0.0,1000.0,1300.0,1500.0,7100.0,5,excelente el servicio. ,2015,1,23,7,1993,1500
122,75,123,1,2,1,2010,4,6,0,,5,5,0,0,15.7,1.0,,4,0,0,1,1,5,9,,0,0,,0,,1500,800.0,0.0,200.0,2500.0,2000.0,1500.0,1800.0,1000.0,1500.0,0.0,3000.0,1000.0,500.0,12300.0,3,3,9570.0,4000.0,13570.0,0.0,5000.0,2000.0,1800.0,1000.0,2000.0,500.0,2500.0,800.0,15600.0,4,Que la trabajadora social envie correos con la actualización de la beca,2014,2,31,5,1993,1500
123,148,124,1,2,1,2013,2,4,0,,5,2,1,2,11.7,0.5127999999999999,"Problemas personales, Deficientes hábitos de estudios, Deficiente formación del bachillerato, Mala distribución del tiempo",5,0,0,21,2,24,3,Calle la providencia Edf Mary Piso 2 Apto 4. El cementerio,0,0,,0,,1500,2500.0,1500.0,0.0,5500.0,1500.0,200.0,0.0,0.0,300.0,1500.0,1500.0,200.0,200.0,5500.0,5,3,6747.0,2000.0,8747.0,0.0,2300.0,0.0,2500.0,0.0,0.0,100.0,0.0,2000.0,6900.0,5,"Algunas personas no poseen Internet, por ello en la cartelera de las Escuelas deberían colocar mas información de las actividades o alguna jornada que este realizando OBE",2014,2,14,12,1992,1500
124,117,125,1,2,1,2011,4,6,0,,6,6,0,0,16.337,1.0,,4,0,0,2,2,3,1,,0,0,,0,,1500,1500.0,0.0,0.0,3000.0,900.0,300.0,0.0,0.0,500.0,0.0,1300.0,0.0,0.0,3000.0,3,2,6137.0,,6137.0,0.0,3000.0,1000.0,0.0,0.0,1100.0,1000.0,0.0,0.0,6100.0,5,me parece muy buena su atención prestada ,2014,2,15,8,1994,1500
125,167,126,1,2,1,2012,4,5,0,,5,5,0,0,15.42,0.9452,,7,0,0,6,4,33,1,"los Teques, municipio Guaicaipuro, urbanización El Paso bloque 2 edificio 2 piso 3 apartamento 04",0,0,,0,,1500,300.0,0.0,0.0,1800.0,0.0,300.0,0.0,0.0,1000.0,0.0,300.0,0.0,200.0,1800.0,3,4,5418.0,,5418.0,0.0,3500.0,300.0,0.0,0.0,0.0,1000.0,200.0,150.0,5150.0,4,"ojala pudieran tener presupuesto para que todos sus servicios funcionaran sin problemas, por ejemplo odontologia",2014,2,27,8,1992,1500
